{
  "id": "v3-eval-w1-slide-summarize-impress-001",
  "wave": "w1",
  "category": "capability",
  "surface": "impress",
  "referenceBaseline": {
    "id": "v2-ga-acceptance",
    "source": "v2-ga",
    "versionPolicy": "frozen-at-v2-ga",
    "frozenAtLedger": "L211",
    "requiresV2RegressionGreen": true,
    "runtimeReferenceImplementation": "not-started"
  },
  "llmJudgePolicy": {
    "enabled": false,
    "promptLibrary": "docs/product/v3/w5-judge-prompt-library.md",
    "promptId": "judge-v3-capability-v1",
    "promptVersion": "v1",
    "deterministicParameters": {
      "temperature": 0,
      "topP": 1,
      "seedRequired": true
    },
    "defaultReleaseGate": false,
    "requiresHumanReviewForPublish": true,
    "runtimeJudgeImplementation": "not-started"
  },
  "input": {
    "documentSnapshot": "fixtures/v3/eval/samples/impress-project-review.odp",
    "selection": {
      "kind": "slide-element",
      "id": "slide-3-title-1"
    },
    "userPrompt": "把这页标题改成更清晰的一句话总结",
    "context": []
  },
  "expected": {
    "patchRef": "docs/qa/fixtures/v3/eval/expected-patches/w1-slide-summarize-impress.patch.json",
    "patchType": "SlideElementAction",
    "tokenCount": 4,
    "diffSimilarity": ">= 0.85",
    "inlineAction": "rewrite-text"
  },
  "scoring": {
    "method": "fuzzy",
    "threshold": 0.85
  }
}
